<?xml version="1.0" encoding="UTF-8"?>
<!ELEMENT actions (action+)>
	<!ELEMENT action (result)>
	<!ATTLIST action path CDATA #REQUIRED>
	<!ATTLIST action className CDATA #REQUIRED>
	<!ATTLIST action methodName CDATA #IMPLIED>
		<!ELEMENT result (#PCDATA)>
		<!ATTLIST result type CDATA #IMPLIED>